=============================================
  Prime_Maxel-v3 GreenPAK NVM Reader
  Factory dump — 2026-05-16
=============================================

=== Channel 0 ===
NVM contents:
00: 00 00 00 00 00 00 00 00 00 00 00 00 00 00 00 00
10: 00 00 00 00 00 00 00 00 00 00 00 00 00 00 00 00
20: 00 00 00 00 00 00 00 00 00 00 00 00 00 00 00 00
30: 00 00 00 00 00 00 00 00 00 00 00 00 00 00 00 00
40: 00 00 00 00 00 00 00 00 00 00 00 00 00 00 00 00
50: 00 00 00 00 00 00 00 00 00 00 00 00 00 00 00 00
60: 00 00 00 00 00 00 00 00 00 00 00 00 00 00 00 00
70: 00 00 00 00 00 00 00 00 00 00 00 00 00 00 00 01
80: A5 20 20 18 22 C4 19 02 18 01 C8 31 00 C0 08 00
90: 00 00 00 00 00 00 00 00 00 00 00 00 00 00 00 00
A0: 00 00 00 00 00 00 00 00 00 00 00 00 00 00 00 00
B0: 00 00 00 00 00 00 00 00 00 00 00 00 00 00 00 00
C0: 00 00 00 00 00 00 00 00 0F 48 F0 00 00 00 00 00
D0: 00 00 00 00 00 00 00 00 00 00 00 00 00 02 08 86
E0: 00 00 00 00 00 00 00 00 01 00 00 00 00 00 00 00
F0: 5A 00 00 01 10 00 00 FF FF 41 0F 10 30 10 12 00

=== Channel 1 ===
NVM contents:
00: 00 00 00 00 00 00 00 00 00 00 00 00 00 00 00 00
10: 00 00 00 00 00 00 00 00 00 00 00 00 00 00 00 00
20: 00 00 00 00 00 00 00 00 00 00 00 00 00 00 00 00
30: 00 00 00 00 00 00 00 00 00 00 00 00 00 00 00 00
40: 00 00 00 00 00 00 00 00 00 00 00 00 00 00 00 00
50: 00 00 00 00 00 00 00 00 00 00 00 00 00 00 00 00
60: 00 00 00 00 00 00 00 00 00 00 00 00 00 00 00 00
70: 00 00 00 00 00 00 00 00 00 00 00 00 00 00 00 01
80: A5 22 21 18 44 00 23 80 38 C0 00 38 C0 80 60 31
90: 00 00 00 00 00 00 00 00 00 00 00 00 00 00 00 00
A0: 00 00 00 00 00 00 00 00 00 00 00 00 00 00 00 00
B0: 00 00 00 00 00 00 00 00 00 00 00 00 00 00 00 00
C0: 00 00 00 00 00 00 00 00 0F 4E F0 00 00 00 00 00
D0: 00 00 00 00 00 00 00 00 00 00 00 00 00 02 08 86
E0: 00 00 00 00 00 00 98 80 90 80 00 00 00 00 00 00
F0: 5A 00 00 01 10 00 00 FF FF 3E 0E 01 30 00 15 00

=== Channel 2 ===
NVM contents:
00: 00 00 00 00 00 00 00 00 00 00 00 00 00 00 00 00
10: 00 00 00 00 00 00 00 00 00 00 00 00 00 00 00 00
20: 00 00 00 00 00 00 00 00 00 00 00 00 00 00 00 00
30: 00 00 00 00 00 00 00 00 00 00 00 00 00 00 00 00
40: 00 00 00 00 00 00 00 00 00 00 00 00 00 00 00 00
50: 00 00 00 00 00 00 00 00 00 00 00 00 00 00 00 00
60: 00 00 00 00 00 00 00 00 00 00 00 00 00 00 00 00
70: 00 00 00 00 00 00 00 00 00 00 00 00 00 00 00 01
80: A5 27 20 12 06 4E 68 80 10 04 08 30 00 3C C6 31
90: 00 00 00 00 00 00 00 00 00 00 00 00 00 00 00 00
A0: 00 00 00 00 00 00 00 00 00 00 00 00 00 00 00 00
B0: 00 00 00 00 00 00 00 00 00 00 00 00 00 00 00 00
C0: 00 00 00 00 00 00 00 00 0F 4E F0 00 00 00 00 00
D0: 00 00 00 00 00 00 00 00 00 00 00 00 00 02 08 86
E0: 00 00 00 00 00 00 20 00 10 00 00 00 00 00 00 00
F0: 5A 00 00 01 10 00 00 FF FF 41 10 10 30 10 12 00

=== Channel 3 ===
NVM contents:
00: 00 00 00 00 00 00 00 00 00 00 00 00 00 00 00 00
10: 00 00 00 00 00 00 00 00 00 00 00 00 00 00 00 00
20: 00 00 00 00 00 00 00 00 00 00 00 00 00 00 00 00
30: 00 00 00 00 00 00 00 00 00 00 00 00 00 00 00 00
40: 00 00 00 00 00 00 00 00 00 00 00 00 00 00 00 00
50: 00 00 00 00 00 00 00 00 00 00 00 00 00 00 00 00
60: 00 00 00 00 00 00 00 00 00 00 00 00 00 00 00 00
70: 00 00 00 00 00 00 00 00 00 00 00 00 00 00 00 01
80: A5 20 24 18 42 14 21 80 21 27 10 32 08 30 07 02
90: 00 00 00 00 00 00 00 00 00 00 00 00 00 00 00 00
A0: 00 00 00 00 00 00 00 00 00 00 00 00 00 00 00 00
B0: 00 00 00 00 00 00 00 00 00 00 00 00 00 00 00 00
C0: 00 00 00 00 00 00 00 00 0F 4E F0 00 00 00 00 00
D0: 00 00 00 00 00 00 00 00 00 00 00 00 00 02 08 86
E0: 00 00 00 00 00 00 00 00 51 00 00 00 00 00 00 00
F0: 5A 00 00 01 10 00 00 FF FF 40 04 12 30 00 12 00

=== Channel 4 ===
NVM contents:
00: 00 00 00 00 00 00 00 00 00 00 00 00 00 00 00 00
10: 00 00 00 00 00 00 00 00 00 00 00 00 00 00 00 00
20: 00 00 00 00 00 00 00 00 00 00 00 00 00 00 00 00
30: 00 00 00 00 00 00 00 00 00 00 00 00 00 00 00 00
40: 00 00 00 00 00 00 00 00 00 00 00 00 00 00 00 00
50: 00 00 00 00 00 00 00 00 00 00 00 00 00 00 00 00
60: 00 00 00 00 00 00 00 00 00 00 00 00 00 00 00 00
70: 00 00 00 00 00 00 00 00 00 00 00 00 00 00 00 01
80: A5 29 24 18 00 0A 08 46 44 80 C0 30 10 40 81 31
90: 00 00 00 00 00 00 00 00 00 00 00 00 00 00 00 00
A0: 00 00 00 00 00 00 00 00 00 00 00 00 00 00 00 00
B0: 00 00 00 00 00 00 00 00 00 00 00 00 00 00 00 00
C0: 00 00 00 00 00 00 00 00 0F 4E F0 00 00 00 00 00
D0: 00 00 00 00 00 00 00 00 00 00 00 00 00 02 08 86
E0: 00 00 00 00 00 00 70 00 00 00 00 00 00 00 00 00
F0: 5A 00 00 01 10 00 00 FF FF 40 10 12 30 06 10 00

=== Channel 5 ===
NVM contents:
00: 00 00 00 00 00 00 00 00 00 00 00 00 00 00 00 00
10: 00 00 00 00 00 00 00 00 00 00 00 00 00 00 00 00
20: 00 00 00 00 00 00 00 00 00 00 00 00 00 00 00 00
30: 00 00 00 00 00 00 00 00 00 00 00 00 00 00 00 00
40: 00 00 00 00 00 00 00 00 00 00 00 00 00 00 00 00
50: 00 00 00 00 00 00 00 00 00 00 00 00 00 00 00 00
60: 00 00 00 00 00 00 00 00 00 00 00 00 00 00 00 00
70: 00 00 00 00 00 00 00 00 00 00 00 00 00 00 00 01
80: A5 28 23 10 01 20 12 00 00 20 00 39 F0 AC 03 00
90: 00 00 00 00 00 00 00 00 00 00 00 00 00 00 00 00
A0: 00 00 00 00 00 00 00 00 00 00 00 00 00 00 00 00
B0: 00 00 00 00 00 00 00 00 00 00 00 00 00 00 00 00
C0: 00 00 00 00 00 00 00 00 0F 4E F0 00 00 00 00 00
D0: 00 00 00 00 00 00 00 00 00 00 00 00 00 02 08 86
E0: 00 00 00 00 00 00 60 00 30 01 00 00 00 00 00 00
F0: 5A 00 00 01 10 00 00 FF FF 40 10 12 30 01 10 00
