================================ 00 00 00 00 00 00 00 
50: 00 00 00 00 00 00 00 00 00 00 00 00 =============================================
  Prime_Maxel-v3 GreenPAK NVM Reader
=============================================

=== Channel 0 ===
  NVM contents:
00: 00 00 00 00 00 00 00 00 00 00 00 00 00 00 00 00 
10: 00 00 00 00 00 00 00 00 00 00 00 00 00 00 00 00 
20: 00 00 00 00 00 00 00 00 00 00 00 00 00 00 00 00 
30: 00 00 00 00 00 00 00 00 00 00 00 00 00 00 00 00 
40: 00 00 00 00 00 00 00 00 00 00 00 00 00 00 00 00 
50: 00 00 00 00 00 00 00 00 00 00 00 00 00 00 00 00 
60: 00 00 00 00 00 00 00 00 00 00 00 00 00 00 00 00 
70: 00 00 00 00 00 00 00 00 00 00 00 00 00 00 00 01 
80: A5 20 20 10 21 4C 11 22 09 40 94 31 18 04 00 42 
90: 00 00 00 00 00 00 00 00 00 00 00 00 00 00 00 00 
A0: 00 00 00 00 00 00 00 00 00 00 00 00 00 00 00 00 
B0: 00 00 00 00 00 00 00 00 00 00 00 00 00 00 00 00 
C0: 00 00 00 00 00 00 00 00 0F 4E F0 00 00 00 00 00 
D0: 00 00 00 00 00 00 00 00 00 00 00 00 00 02 08 86 
E0: 00 00 00 00 00 00 48 00 03 00 00 00 00 00 00 00 
F0: 5A 00 00 01 10 00 00 FF FF 01 02 10 30 11 14 00 

  Active registers:
  (35 non-zero bytes)
00: 00 00 00 00 00 00 00 00 00 00 00 00 00 00 00 00 
10: 00 00 00 00 00 00 00 00 00 00 00 00 00 00 00 00 
20: 00 00 00 00 00 00 00 00 00 00 00 00 00 00 00 00 
30: 00 00 00 00 00 00 00 00 00 00 00 00 00 00 00 00 
40: 00 00 00 00 00 00 00 00 00 00 00 00 00 00 00 00 
50: 00 00 00 00 00 00 00 00 00 00 00 00 00 00 00 00 
60: 00 00 00 00 00 00 00 00 00 00 00 00 00 00 00 00 
70: 00 00 00 00 00 00 00 00 00 00 00 00 00 00 00 01 
80: A5 20 20 10 21 4C 11 22 09 40 94 31 18 04 00 42 
90: 00 00 00 00 00 00 00 00 00 00 00 00 00 00 00 00 
A0: 00 00 00 00 00 00 00 00 00 00 00 00 00 00 00 00 
B0: 00 00 00 00 00 00 00 00 00 00 00 00 00 00 00 00 
C0: 00 00 00 00 00 00 00 00 0F 4E F0 00 00 00 00 00 
D0: 00 00 00 00 00 00 00 00 00 00 00 00 00 02 08 86 
E0: 00 00 00 00 00 00 48 00 03 00 00 00 00 00 00 00 
F0: 5A 00 00 01 10 00 00 FF FF 01 02 10 30 11 14 00 


=== Channel 1 ===
  NVM contents:
00: 00 00 00 00 00 00 00 00 00 00 00 00 00 00 00 00 
10: 00 00 00 00 00 00 00 00 00 00 00 00 00 00 00 00 
20: 00 00 00 00 00 00 00 00 00 00 00 00 00 00 00 00 
30: 00 00 00 00 00 00 00 00 00 00 00 00 00 00 00 00 
40: 00 00 00 00 00 00 00 00 00 00 00 00 00 00 00 00 
50: 00 00 00 00 00 00 00 00 00 00 00 00 00 00 00 00 
60: 00 00 00 00 00 00 00 00 00 00 00 00 00 00 00 00 
70: 00 00 00 00 00 00 00 00 00 00 00 00 00 00 00 01 
80: A5 2A 22 18 00 99 08 02 00 00 4C 3A 00 00 60 29 
90: 00 00 00 00 00 00 00 00 00 00 00 00 00 00 00 00 
A0: 00 00 00 00 00 00 00 00 00 00 00 00 00 00 00 00 
B0: 00 00 00 00 00 00 00 00 00 00 00 00 00 00 00 00 
C0: 00 00 00 00 00 00 00 00 0F 4E F0 00 00 00 00 00 
D0: 00 00 00 00 00 00 00 00 00 00 00 00 00 02 08 86 
E0: 00 00 00 00 00 00 B2 00 83 00 00 00 00 00 00 00 
F0: 5A 00 00 01 10 00 00 FF FF 40 0C 01 30 10 13 00 

  Active registers:
  (31 non-zero bytes)
00: 00 00 00 00 00 00 00 00 00 00 00 00 00 00 00 00 
10: 00 00 00 00 00 00 00 00 00 00 00 00 00 00 00 00 
20: 00 00 00 00 00 00 00 00 00 00 00 00 00 00 00 00 
30: 00 00 00 00 00 00 00 00 00 00 00 00 00 00 00 00 
40: 00 00 00 00 00 00 00 00 00 00 00 00 00 00 00 00 
50: 00 00 00 00 00 00 00 00 00 00 00 00 00 00 00 00 
60: 00 00 00 00 00 00 00 00 00 00 00 00 00 00 00 00 
70: 00 00 00 00 00 00 00 00 00 00 00 00 00 00 00 01 
80: A5 2A 22 18 00 99 08 02 00 00 4C 3A 00 00 60 29 
90: 00 00 00 00 00 00 00 00 00 00 00 00 00 00 00 00 
A0: 00 00 00 00 00 00 00 00 00 00 00 00 00 00 00 00 
B0: 00 00 00 00 00 00 00 00 00 00 00 00 00 00 00 00 
C0: 00 00 00 00 00 00 00 00 0F 4E F0 00 00 00 00 00 
D0: 00 00 00 00 00 00 00 00 00 00 00 00 00 02 08 86 
E0: 00 00 00 00 00 00 B2 00 83 00 00 00 00 00 00 00 
F0: 5A 00 00 01 10 00 00 FF FF 40 0C 01 30 10 13 00 


=== Channel 2 ===
  NVM contents:
00: 00 00 00 00 00 00 00 00 00 00 00 00 00 00 00 00 
10: 00 00 00 00 00 00 00 00 00 00 00 00 00 00 00 00 
20: 00 00 00 00 00 00 00 00 00 00 00 00 00 00 00 00 
30: 00 00 00 00 00 00 00 00 00 00 00 00 00 00 00 00 
40: 00 00 00 00 00 00 00 00 00 00 00 00 00 00 00 00 
50: 00 00 00 00 00 00 00 00 00 00 00 00 00 00 00 00 
60: 00 00 00 00 00 00 00 00 00 00 00 00 00 00 00 00 
70: 00 00 00 00 00 00 00 00 00 00 00 00 00 00 00 01 
80: A5 20 20 11 20 8C 68 02 0A 20 C4 30 65 80 C7 4A 
90: 00 00 00 00 00 00 00 00 00 00 00 00 00 00 00 00 
A0: 00 00 00 00 00 00 00 00 00 00 00 00 00 00 00 00 
B0: 00 00 00 00 00 00 00 00 00 00 00 00 00 00 00 00 
C0: 00 00 00 00 00 00 00 00 0F 4E F0 00 00 00 00 00 
D0: 00 00 00 00 00 00 00 00 00 00 00 00 00 02 08 86 
E0: 00 00 00 00 00 00 28 01 0E 02 00 00 00 00 00 00 
F0: 5A 00 00 01 10 00 00 FF FF 40 00 12 30 11 10 00 

  Active registers:
  (37 non-zero bytes)
00: 00 00 00 00 00 00 00 00 00 00 00 00 00 00 00 00 
10: 00 00 00 00 00 00 00 00 00 00 00 00 00 00 00 00 
20: 00 00 00 00 00 00 00 00 00 00 00 00 00 00 00 00 
30: 00 00 00 00 00 00 00 00 00 00 00 00 00 00 00 00 
40: 00 00 00 00 00 00 00 00 00 00 00 00 00 00 00 00 
50: 00 00 00 00 00 00 00 00 00 00 00 00 00 00 00 00 
60: 00 00 00 00 00 00 00 00 00 00 00 00 00 00 00 00 
70: 00 00 00 00 00 00 00 00 00 00 00 00 00 00 00 01 
80: A5 20 20 11 20 8C 68 02 0A 20 C4 30 65 80 C7 4A 
90: 00 00 00 00 00 00 00 00 00 00 00 00 00 00 00 00 
A0: 00 00 00 00 00 00 00 00 00 00 00 00 00 00 00 00 
B0: 00 00 00 00 00 00 00 00 00 00 00 00 00 00 00 00 
C0: 00 00 00 00 00 00 00 00 0F 4E F0 00 00 00 00 00 
D0: 00 00 00 00 00 00 00 00 00 00 00 00 00 02 08 86 
E0: 00 00 00 00 00 00 28 01 0E 02 00 00 00 00 00 00 
F0: 5A 00 00 01 10 00 00 FF FF 40 00 12 30 11 10 00 


=== Channel 3 ===
  NVM contents:
00: 00 00 00 00 00 00 00 00 00 00 00 00 00 00 00 00 
10: 00 00 00 00 00 00 00 00 00 00 00 00 00 00 00 00 
20: 00 00 00 00 00 00 00 00 00 00 00 00 00 00 00 00 
30: 00 00 00 00 00 00 00 00 00 00 00 00 00 00 00 00 
40: 00 00 00 00 00 00 00 00 00 00 00 00 00 00 00 00 
50: 00 00 00 00 00 00 00 00 00 00 00 00 00 00 00 00 
60: 00 00 00 00 00 00 00 00 00 00 00 00 00 00 00 00 
70: 00 00 00 00 00 00 00 00 00 00 00 00 00 00 00 01 
80: A5 20 21 19 A4 80 10 02 00 20 20 B1 A5 C0 82 09 
90: 00 00 00 00 00 00 00 00 00 00 00 00 00 00 00 00 
A0: 00 00 00 00 00 00 00 00 00 00 00 00 00 00 00 00 
B0: 00 00 00 00 00 00 00 00 00 00 00 00 00 00 00 00 
C0: 00 00 00 00 00 00 00 00 0F 4E F0 00 00 00 00 00 
D0: 00 00 00 00 00 00 00 00 00 00 00 00 00 02 08 86 
E0: 00 00 00 00 00 00 1C 00 20 00 00 00 00 00 00 00 
F0: 5A 00 00 01 10 00 00 FF FF 01 10 10 30 03 12 00 

  Active registers:
  (35 non-zero bytes)
00: 00 00 00 00 00 00 00 00 00 00 00 00 00 00 00 00 
10: 00 00 00 00 00 00 00 00 00 00 00 00 00 00 00 00 
20: 00 00 00 00 00 00 00 00 00 00 00 00 00 00 00 00 
30: 00 00 00 00 00 00 00 00 00 00 00 00 00 00 00 00 
40: 00 00 00 00 00 00 00 00 00 00 00 00 00 00 00 00 
50: 00 00 00 00 00 00 00 00 00 00 00 00 00 00 00 00 
60: 00 00 00 00 00 00 00 00 00 00 00 00 00 00 00 00 
70: 00 00 00 00 00 00 00 00 00 00 00 00 00 00 00 01 
80: A5 20 21 19 A4 80 10 02 00 20 20 B1 A5 C0 82 09 
90: 00 00 00 00 00 00 00 00 00 00 00 00 00 00 00 00 
A0: 00 00 00 00 00 00 00 00 00 00 00 00 00 00 00 00 
B0: 00 00 00 00 00 00 00 00 00 00 00 00 00 00 00 00 
C0: 00 00 00 00 00 00 00 00 0F 4E F0 00 00 00 00 00 
D0: 00 00 00 00 00 00 00 00 00 00 00 00 00 02 08 86 
E0: 00 00 00 00 00 00 1C 00 20 00 00 00 00 00 00 00 
F0: 5A 00 00 01 10 00 00 FF FF 01 10 10 30 03 12 00 


=== Channel 4 ===
  NVM contents:
00: 00 00 00 00 00 00 00 00 00 00 00 00 00 00 00 00 
10: 00 00 00 00 00 00 00 00 00 00 00 00 00 00 00 00 
20: 00 00 00 00 00 00 00 00 00 00 00 00 00 00 00 00 
30: 00 00 00 00 00 00 00 00 00 00 00 00 00 00 00 00 
40: 00 00 00 00 00 00 00 00 00 00 00 00 00 00 00 00 
50: 00 00 00 00 00 00 00 00 00 00 00 00 00 00 00 00 
60: 00 00 00 00 00 00 00 00 00 00 00 00 00 00 00 00 
70: 00 00 00 00 00 00 00 00 00 00 00 00 00 00 00 01 
80: A5 22 20 11 20 02 02 00 22 44 00 30 90 20 04 24 
90: 00 00 00 00 00 00 00 00 00 00 00 00 00 00 00 00 
A0: 00 00 00 00 00 00 00 00 00 00 00 00 00 00 00 00 
B0: 00 00 00 00 00 00 00 00 00 00 00 00 00 00 00 00 
C0: 00 00 00 00 00 00 00 00 0F 4E F0 00 00 00 00 00 
D0: 00 00 00 00 00 00 00 00 00 00 00 00 00 02 08 86 
E0: 00 00 00 00 00 00 04 02 42 02 00 00 00 00 00 00 
F0: 5A 00 00 01 10 00 00 FF FF 40 10 10 30 03 12 00 

  Active registers:
  (36 non-zero bytes)
00: 00 00 00 00 00 00 00 00 00 00 00 00 00 00 00 00 
10: 00 00 00 00 00 00 00 00 00 00 00 00 00 00 00 00 
20: 00 00 00 00 00 00 00 00 00 00 00 00 00 00 00 00 
30: 00 00 00 00 00 00 00 00 00 00 00 00 00 00 00 00 
40: 00 00 00 00 00 00 00 00 00 00 00 00 00 00 00 00 
50: 00 00 00 00 00 00 00 00 00 00 00 00 00 00 00 00 
60: 00 00 00 00 00 00 00 00 00 00 00 00 00 00 00 00 
70: 00 00 00 00 00 00 00 00 00 00 00 00 00 00 00 01 
80: A5 22 20 11 20 02 02 00 22 44 00 30 90 20 04 24 
90: 00 00 00 00 00 00 00 00 00 00 00 00 00 00 00 00 
A0: 00 00 00 00 00 00 00 00 00 00 00 00 00 00 00 00 
B0: 00 00 00 00 00 00 00 00 00 00 00 00 00 00 00 00 
C0: 00 00 00 00 00 00 00 00 0F 4E F0 00 00 00 00 00 
D0: 00 00 00 00 00 00 00 00 00 00 00 00 00 02 08 86 
E0: 00 00 00 00 00 00 04 02 42 02 00 00 00 00 00 00 
F0: 5A 00 00 01 10 00 00 FF FF 40 10 10 30 03 12 00 


=== Channel 5 ===
  NVM contents:
00: 00 00 00 00 00 00 00 00 00 00 00 00 00 00 00 00 
10: 00 00 00 00 00 00 00 00 00 00 00 00 00 00 00 00 
20: 00 00 00 00 00 00 00 00 00 00 00 00 00 00 00 00 
30: 00 00 00 00 00 00 00 00 00 00 00 00 00 00 00 00 
40: 00 00 00 00 00 00 00 00 00 00 00 00 00 00 00 00 
50: 00 00 00 00 00 00 00 00 00 00 00 00 00 00 00 00 
60: 00 00 00 00 00 00 00 00 00 00 00 00 00 00 00 00 
70: 00 00 00 00 00 00 00 00 00 00 00 00 00 00 00 01 
80: A5 21 21 18 C7 08 43 24 80 00 04 B0 02 20 86 21 
90: 00 00 00 00 00 00 00 00 00 00 00 00 00 00 00 00 
A0: 00 00 00 00 00 00 00 00 00 00 00 00 00 00 00 00 
B0: 00 00 00 00 00 00 00 00 00 00 00 00 00 00 00 00 
C0: 00 00 00 00 00 00 00 00 0F 4E F0 00 00 00 00 00 
D0: 00 00 00 00 00 00 00 00 00 00 00 00 00 02 08 86 
E0: 00 00 00 00 00 00 0C 00 20 00 00 00 00 00 00 00 
F0: 5A 00 00 01 10 00 00 FF FF 40 10 12 30 00 14 00 

  Active registers:
  (34 non-zero bytes)
00: 00 00 00 00 00 00 00 00 00 00 00 00 00 00 00 00 
10: 00 00 00 00 00 00 00 00 00 00 00 00 00 00 00 00 
20: 00 00 00 00 00 00 00 00 00 00 00 00 00 00 00 00 
30: 00 00 00 00 00 00 00 00 00 00 00 00 00 00 00 00 
40: 00 00 00 00 00 00 00 00 00 00 00 00 00 00 00 00 
50: 00 00 00 00 00 00 00 00 00 00 00 00 00 00 00 00 
60: 00 00 00 00 00 00 00 00 00 00 00 00 00 00 00 00 
70: 00 00 00 00 00 00 00 00 00 00 00 00 00 00 00 01 
80: A5 21 21 18 C7 08 43 24 80 00 04 B0 02 20 86 21 
90: 00 00 00 00 00 00 00 00 00 00 00 00 00 00 00 00 
A0: 00 00 00 00 00 00 00 00 00 00 00 00 00 00 00 00 
B0: 00 00 00 00 00 00 00 00 00 00 00 00 00 00 00 00 
C0: 00 00 00 00 00 00 00 00 0F 4E F0 00 00 00 00 00 
D0: 00 00 00 00 00 00 00 00 00 00 00 00 00 02 08 86 
E0: 00 00 00 00 00 00 0C 00 20 00 00 00 00 00 00 00 
F0: 5A 00 00 01 10 00 00 FF FF 40 10 12 30 00 14 00 


Done! Copy this output for your records.
